{
  "id": "joern",
  "display_name": "Joern CPG / Data-flow",
  "version": "1.0",
  "execution": "local-artifact",
  "network_default": "disabled",
  "inputs": ["CodeSlicerJoernInterchange/v1 JSON"],
  "evidence_class": "CPG_DATAFLOW",
  "resource_profile": "heavy-optional",
  "affects_review_ranking": false
}
