{
  "id": "otel",
  "display_name": "OpenTelemetry Runtime Evidence",
  "version": "1.0",
  "execution": "local-artifact",
  "network_default": "disabled",
  "inputs": ["OTLP JSON export", "Jaeger JSON export"],
  "evidence_class": "RUNTIME_OBSERVED",
  "resource_profile": "optional",
  "affects_review_ranking": false
}
